{"commit": "59f5557 Set config to be suitable for testing", "fields": {"tpr": {"field_text": "Time per request", "value_text": "11.339 [ms] (mean, across all concurrent requests)", "name": "tpr", "value": {"raw": 11.339, "unit": "milliseconds"}}, "Document Path": {"field_text": "Document Path", "value_text": "/static/kilobyte.zero", "name": "Document Path", "value": "/static/kilobyte.zero"}, "Complete requests": {"field_text": "Complete requests", "value_text": "4000", "name": "Complete requests", "value": 4000.0}, "Requests per second": {"field_text": "Requests per second", "value_text": "88.19 [#/sec] (mean)", "name": "Requests per second", "value": 88.19}, "Failed requests": {"field_text": "Failed requests", "value_text": "0", "name": "Failed requests", "value": 0.0}, "Concurrency Level": {"field_text": "Concurrency Level", "value_text": "1", "name": "Concurrency Level", "value": 1.0}, "ttt": {"field_text": "Time taken for tests", "value_text": "45.355 seconds", "name": "ttt", "value": {"raw": 45.355, "unit": "seconds"}}}, "raw": "This is ApacheBench, Version 2.3 <$Revision: 1706008 $>\nCopyright 1996 Adam Twiss, Zeus Technology Ltd, http://www.zeustech.net/\nLicensed to The Apache Software Foundation, http://www.apache.org/\n\nBenchmarking localhost (be patient)\n\n\nServer Software:        \nServer Hostname:        localhost\nServer Port:            5678\n\nDocument Path:          /static/kilobyte.zero\nDocument Length:        1057 bytes\n\nConcurrency Level:      1\nTime taken for tests:   45.355 seconds\nComplete requests:      4000\nFailed requests:        0\nTotal transferred:      4380000 bytes\nHTML transferred:       4228000 bytes\nRequests per second:    88.19 [#/sec] (mean)\nTime per request:       11.339 [ms] (mean)\nTime per request:       11.339 [ms] (mean, across all concurrent requests)\nTransfer rate:          94.31 [Kbytes/sec] received\n\nConnection Times (ms)\n              min  mean[+/-sd] median   max\nConnect:        0    0   0.0      0       1\nProcessing:     7   11   3.6     10      37\nWaiting:        6   10   3.5      9      35\nTotal:          7   11   3.6     10      37\n\nPercentage of the requests served within a certain time (ms)\n  50%     10\n  66%     12\n  75%     13\n  80%     14\n  90%     16\n  95%     18\n  98%     22\n  99%     24\n 100%     37 (longest request)\n"}