{"commit": "59f5557 Set config to be suitable for testing", "fields": {"tpr": {"field_text": "Time per request", "value_text": "8.818 [ms] (mean, across all concurrent requests)", "name": "tpr", "value": {"raw": 8.818, "unit": "milliseconds"}}, "Document Path": {"field_text": "Document Path", "value_text": "/static/kilobyte.zero", "name": "Document Path", "value": "/static/kilobyte.zero"}, "Complete requests": {"field_text": "Complete requests", "value_text": "4000", "name": "Complete requests", "value": 4000.0}, "Requests per second": {"field_text": "Requests per second", "value_text": "113.40 [#/sec] (mean)", "name": "Requests per second", "value": 113.4}, "Failed requests": {"field_text": "Failed requests", "value_text": "0", "name": "Failed requests", "value": 0.0}, "Concurrency Level": {"field_text": "Concurrency Level", "value_text": "100", "name": "Concurrency Level", "value": 100.0}, "ttt": {"field_text": "Time taken for tests", "value_text": "35.272 seconds", "name": "ttt", "value": {"raw": 35.272, "unit": "seconds"}}}, "raw": "This is ApacheBench, Version 2.3 <$Revision: 1706008 $>\nCopyright 1996 Adam Twiss, Zeus Technology Ltd, http://www.zeustech.net/\nLicensed to The Apache Software Foundation, http://www.apache.org/\n\nBenchmarking localhost (be patient)\n\n\nServer Software:        \nServer Hostname:        localhost\nServer Port:            5678\n\nDocument Path:          /static/kilobyte.zero\nDocument Length:        1057 bytes\n\nConcurrency Level:      100\nTime taken for tests:   35.272 seconds\nComplete requests:      4000\nFailed requests:        0\nTotal transferred:      4380000 bytes\nHTML transferred:       4228000 bytes\nRequests per second:    113.40 [#/sec] (mean)\nTime per request:       881.804 [ms] (mean)\nTime per request:       8.818 [ms] (mean, across all concurrent requests)\nTransfer rate:          121.27 [Kbytes/sec] received\n\nConnection Times (ms)\n              min  mean[+/-sd] median   max\nConnect:        0    0   1.7      0      13\nProcessing:     9  871 178.7    814    1506\nWaiting:        8  868 178.1    811    1491\nTotal:         20  872 178.0    814    1506\n\nPercentage of the requests served within a certain time (ms)\n  50%    814\n  66%    830\n  75%    866\n  80%    908\n  90%   1049\n  95%   1371\n  98%   1440\n  99%   1455\n 100%   1506 (longest request)\n"}