{"commit": "59f5557 Set config to be suitable for testing", "fields": {"tpr": {"field_text": "Time per request", "value_text": "8.187 [ms] (mean, across all concurrent requests)", "name": "tpr", "value": {"raw": 8.187, "unit": "milliseconds"}}, "Document Path": {"field_text": "Document Path", "value_text": "/static/kilobyte.zero", "name": "Document Path", "value": "/static/kilobyte.zero"}, "Complete requests": {"field_text": "Complete requests", "value_text": "4000", "name": "Complete requests", "value": 4000.0}, "Requests per second": {"field_text": "Requests per second", "value_text": "122.15 [#/sec] (mean)", "name": "Requests per second", "value": 122.15}, "Failed requests": {"field_text": "Failed requests", "value_text": "0", "name": "Failed requests", "value": 0.0}, "Concurrency Level": {"field_text": "Concurrency Level", "value_text": "20", "name": "Concurrency Level", "value": 20.0}, "ttt": {"field_text": "Time taken for tests", "value_text": "32.747 seconds", "name": "ttt", "value": {"raw": 32.747, "unit": "seconds"}}}, "raw": "This is ApacheBench, Version 2.3 <$Revision: 1706008 $>\nCopyright 1996 Adam Twiss, Zeus Technology Ltd, http://www.zeustech.net/\nLicensed to The Apache Software Foundation, http://www.apache.org/\n\nBenchmarking localhost (be patient)\n\n\nServer Software:        \nServer Hostname:        localhost\nServer Port:            5678\n\nDocument Path:          /static/kilobyte.zero\nDocument Length:        1057 bytes\n\nConcurrency Level:      20\nTime taken for tests:   32.747 seconds\nComplete requests:      4000\nFailed requests:        0\nTotal transferred:      4380000 bytes\nHTML transferred:       4228000 bytes\nRequests per second:    122.15 [#/sec] (mean)\nTime per request:       163.736 [ms] (mean)\nTime per request:       8.187 [ms] (mean, across all concurrent requests)\nTransfer rate:          130.62 [Kbytes/sec] received\n\nConnection Times (ms)\n              min  mean[+/-sd] median   max\nConnect:        0    0   0.1      0       2\nProcessing:    15  163  19.1    161     313\nWaiting:       14  161  18.4    158     307\nTotal:         16  163  19.0    161     313\n\nPercentage of the requests served within a certain time (ms)\n  50%    161\n  66%    166\n  75%    169\n  80%    171\n  90%    178\n  95%    185\n  98%    216\n  99%    259\n 100%    313 (longest request)\n"}